{
  "approved_at": "2026-06-16T09:36:29Z",
  "files": [
    "SKILL.md",
    "skill.json"
  ],
  "findings": [],
  "hashes": {
    "manifest_sha256": "b5d6ffd88a340477244554eac9d916b34100221d5bdfe8f8764fe9a67e0daf7e",
    "sanitized_sha256": "a12fb2d03e7c3df96d5069a2f4231459d45046127334c20410b68d148d5b638a",
    "source_sha256": "865e08fee3b2450b713ef572b949363ff842bfee9c693849f87e00994cdd801e"
  },
  "recommendation": "Keep quarantined until sanitization and verifier binding are complete.",
  "removed_fragments": [],
  "required_verifiers": [],
  "schema_version": 1,
  "skill_name": "design-visual-quality-review",
  "source": {
    "author": "OneCode Project",
    "captured_at": "2026-06-16T09:36:18Z",
    "collected_by": "onecode-local-seed",
    "license": "Apache-2.0",
    "path": "batches/batch-015-scenario-capability-expansion/design-visual-quality-review",
    "reference": "docs/updates/2026-06-16-scenario-system-expansion.md",
    "type": "local_folder",
    "url": "https://github.com/aidi1723/safe-agent-skills/tree/main/batches/batch-015-scenario-capability-expansion",
    "usage": "local_authoring"
  },
  "summary": {
    "preserved_sections": [],
    "removed_fragment_count": 0,
    "rewritten_fragment_count": 0,
    "risk_level": "low",
    "status": "trusted",
    "unresolved_finding_count": 0
  },
  "taxonomy": {
    "artifact_type": "interface",
    "category": "design",
    "collection_priority": "P0",
    "subcategory": "design.visual",
    "task_intent": "review frontend visual quality and AI-generated UI polish"
  }
}
