{
  "approved_at": "2026-06-05T13:01:13Z",
  "files": [
    "SKILL.md",
    "skill.json"
  ],
  "findings": [],
  "hashes": {
    "manifest_sha256": "6f492c046272f4d20c6946ae98b9d7d9697abdfd18b8240b50deb61a34b03dd8",
    "sanitized_sha256": "dc9d9107d239bcb8d2470ca81b9c91cce9318934a7b21225b5f3dacaa6d38731",
    "source_sha256": "9d4befd7337a96bee73d4083e1dae474a77dc698abc5a51757df5cf243576a49"
  },
  "recommendation": "Keep quarantined until sanitization and verifier binding are complete.",
  "removed_fragments": [],
  "required_verifiers": [],
  "schema_version": 1,
  "skill_name": "code-ast-refactor-safety",
  "source": {
    "author": "OneCode Project",
    "captured_at": "2026-06-05T13:01:03Z",
    "collected_by": "onecode-local-seed",
    "license": "Apache-2.0",
    "path": "batches/batch-012-code-quality-guardrails/code-ast-refactor-safety",
    "reference": "docs/batches/batch-012-code-quality-guardrails.md",
    "type": "local_folder",
    "url": "https://github.com/aidi1723/safe-agent-skills/tree/main/batches/batch-012-code-quality-guardrails/code-ast-refactor-safety",
    "usage": "local_authoring"
  },
  "summary": {
    "preserved_sections": [],
    "removed_fragment_count": 0,
    "rewritten_fragment_count": 0,
    "risk_level": "low",
    "status": "trusted",
    "unresolved_finding_count": 0
  },
  "taxonomy": {
    "artifact_type": "code",
    "category": "code",
    "collection_priority": "P0",
    "subcategory": "code.refactor",
    "task_intent": "review structural refactor safety"
  }
}
