{
  "approved_at": "2026-06-04T07:05:34Z",
  "files": [
    "SKILL.md",
    "skill.json"
  ],
  "findings": [],
  "hashes": {
    "manifest_sha256": "61f4f2ce8adc146a55f3597fd2c0b3d4da8c524cbff8cfa21d6c312b84ceec0a",
    "sanitized_sha256": "0974ec28ce2153192dd511a589dda9ad50599d405a57cc598476ebe4af77474d",
    "source_sha256": "718da8eb550b947211605894d823c991e48c834609aae89a512a82c93ea09861"
  },
  "recommendation": "Keep quarantined until sanitization and verifier binding are complete.",
  "removed_fragments": [],
  "required_verifiers": [],
  "schema_version": 1,
  "skill_name": "data-table-analysis",
  "source": {
    "author": "OneCode Project",
    "captured_at": "2026-06-04T07:05:20Z",
    "collected_by": "onecode-local-seed",
    "license": "Apache-2.0",
    "path": "batches/batch-002-p1-seed/data-table-analysis",
    "reference": "docs/batches/batch-002-p1-seed.md",
    "type": "local_folder",
    "url": "https://github.com/aidi1723/onecode/tree/main/onecode-skill-sanitizer/batches/batch-002-p1-seed/data-table-analysis",
    "usage": "local_authoring"
  },
  "summary": {
    "preserved_sections": [],
    "removed_fragment_count": 0,
    "rewritten_fragment_count": 0,
    "risk_level": "low",
    "status": "trusted",
    "unresolved_finding_count": 0
  },
  "taxonomy": {
    "artifact_type": "dataset",
    "category": "data",
    "collection_priority": "P1",
    "subcategory": "data.analysis",
    "task_intent": "analyze tabular data with reproducible checks"
  }
}
