{
  "approved_at": "2026-07-02T12:20:29Z",
  "files": [
    "SKILL.md",
    "skill.json"
  ],
  "findings": [],
  "hashes": {
    "manifest_sha256": "9815a413a1178d5e8660560daf6300b1097de8222a95e832cf7b8ba3ee20b002",
    "sanitized_sha256": "1332eb8fe166f052053f09f2f4d594b2fc57f8c31b566318b255ea20e330dd31",
    "source_sha256": "937dcb7e6a1e336cfaaa3777f250d77c558e1826fecfd342eedd466dd4c0a80a"
  },
  "recommendation": "Keep quarantined until sanitization and verifier binding are complete.",
  "removed_fragments": [],
  "required_verifiers": [],
  "schema_version": 1,
  "skill_name": "business-saas-metrics-review",
  "source": {
    "author": "OneCode Project",
    "captured_at": "2026-07-02T12:20:23Z",
    "collected_by": "onecode-claude-skills-expansion",
    "license": "Apache-2.0",
    "path": "batches/batch-016-claude-skills-expansion/business-saas-metrics-review",
    "reference": "docs/batches/batch-016-claude-skills-expansion.md; metadata-only audit of https://github.com/alirezarezvani/claude-skills",
    "type": "local_folder",
    "url": "https://github.com/aidi1723/safe-agent-skills/tree/main/batches/batch-016-claude-skills-expansion",
    "usage": "local_authoring"
  },
  "summary": {
    "preserved_sections": [],
    "removed_fragment_count": 0,
    "rewritten_fragment_count": 0,
    "risk_level": "low",
    "status": "trusted",
    "unresolved_finding_count": 0
  },
  "taxonomy": {
    "artifact_type": "report",
    "category": "business",
    "collection_priority": "P0",
    "subcategory": "business.metrics",
    "task_intent": "review SaaS recurring revenue, retention, churn, and efficiency metrics"
  }
}
