{
  "approved_at": "2026-07-02T13:57:07Z",
  "files": [
    "SKILL.md",
    "skill.json"
  ],
  "findings": [],
  "hashes": {
    "manifest_sha256": "5c4a732bdd1e3153c4eaca94210ac2f2f556aa784586fc784df5f00b6089704b",
    "sanitized_sha256": "75285cd0a3c0a046d29455861fd32e470e533608ece6210c906fe7ef445a44bf",
    "source_sha256": "6b24b37ea6e513056cab3e3dfc21633736a611eb4d4490fd97e18cc050f7762b"
  },
  "recommendation": "Keep quarantined until sanitization and verifier binding are complete.",
  "removed_fragments": [],
  "required_verifiers": [],
  "schema_version": 1,
  "skill_name": "commerce-commercial-operations-review",
  "source": {
    "author": "OneCode Project",
    "captured_at": "2026-07-02T13:57:00Z",
    "collected_by": "onecode-claude-skills-authoring-wave",
    "license": "Apache-2.0",
    "path": "batches/batch-028-claude-skills-authoring-wave/commerce-commercial-operations-review",
    "reference": "docs/batches/batch-028-claude-skills-authoring-wave.md; metadata-only claude-skills authoring wave",
    "type": "local_folder",
    "url": "https://github.com/aidi1723/safe-agent-skills",
    "usage": "local_authoring"
  },
  "summary": {
    "preserved_sections": [],
    "removed_fragment_count": 0,
    "rewritten_fragment_count": 0,
    "risk_level": "low",
    "status": "trusted",
    "unresolved_finding_count": 0
  },
  "taxonomy": {
    "artifact_type": "workflow",
    "category": "commerce",
    "collection_priority": "P0",
    "subcategory": "commerce.operations",
    "task_intent": "review commercial operations workflows, deal governance, buyer qualification, pricing coordination, and revenue handoffs"
  }
}
