{
  "approved_at": "2026-06-04T09:25:13Z",
  "files": [
    "SKILL.md",
    "skill.json"
  ],
  "findings": [],
  "hashes": {
    "manifest_sha256": "84dd2d390de670549ec45293f794ab055e78454fa934a5daafa90d6c9173ba2c",
    "sanitized_sha256": "d60f77bcafb22d66282bc8b82c8529ef4a34ada222b635a831d9a5077b953421",
    "source_sha256": "fd22d2a130d9bf6b067296ae5083962373644e7df09e2512666409a04753d1df"
  },
  "recommendation": "Keep quarantined until sanitization and verifier binding are complete.",
  "removed_fragments": [],
  "required_verifiers": [],
  "schema_version": 1,
  "skill_name": "ai-outlines-structured-generation",
  "source": {
    "author": "dottxt-ai",
    "captured_at": "2026-06-04T09:21:50Z",
    "collected_by": "onecode-community-review",
    "license": "Apache-2.0",
    "path": "batches/batch-006-community-infrastructure/ai-outlines-structured-generation",
    "reference": "Community project reference: Outlines, structured outputs",
    "type": "github_reference",
    "url": "https://github.com/dottxt-ai/outlines",
    "usage": "reference_only"
  },
  "summary": {
    "preserved_sections": [],
    "removed_fragment_count": 0,
    "rewritten_fragment_count": 0,
    "risk_level": "low",
    "status": "trusted",
    "unresolved_finding_count": 0
  },
  "taxonomy": {
    "artifact_type": "schema",
    "category": "ai",
    "collection_priority": "P0",
    "subcategory": "ai.structured_generation",
    "task_intent": "produce parser-safe structured AI outputs"
  }
}
