{
  "approved_at": "2026-06-04T07:47:37Z",
  "files": [
    "SKILL.md",
    "skill.json"
  ],
  "findings": [],
  "hashes": {
    "manifest_sha256": "1b85582183e0ecd7d0ea28c84587c48a1a027eceef78ef8b9f7bb34db08c68fc",
    "sanitized_sha256": "c28b571a1903db977954b304ceea6dc14631ae75f1cb97e1c25a77262f206545",
    "source_sha256": "96814e2209ddb2d85f8520c559965ff9e71187b7e41588a3ed88ae0ed38aeb37"
  },
  "recommendation": "Keep quarantined until sanitization and verifier binding are complete.",
  "removed_fragments": [],
  "required_verifiers": [],
  "schema_version": 1,
  "skill_name": "media-brand-asset-pack",
  "source": {
    "author": "OneCode Project",
    "captured_at": "2026-06-04T07:47:13Z",
    "collected_by": "onecode-local-seed",
    "license": "Apache-2.0",
    "path": "batches/batch-005-minimum-three/media-brand-asset-pack",
    "reference": "docs/batches/batch-005-minimum-three.md",
    "type": "local_folder",
    "url": "https://github.com/aidi1723/onecode/tree/main/onecode-skill-sanitizer/batches/batch-005-minimum-three/media-brand-asset-pack",
    "usage": "local_authoring"
  },
  "summary": {
    "preserved_sections": [],
    "removed_fragment_count": 0,
    "rewritten_fragment_count": 0,
    "risk_level": "low",
    "status": "trusted",
    "unresolved_finding_count": 0
  },
  "taxonomy": {
    "artifact_type": "asset",
    "category": "media",
    "collection_priority": "P2",
    "subcategory": "media.brand",
    "task_intent": "organize and review brand media asset packs"
  }
}
