{
  "approved_at": "2026-06-04T07:47:37Z",
  "files": [
    "SKILL.md",
    "skill.json"
  ],
  "findings": [],
  "hashes": {
    "manifest_sha256": "bd725a8bc9a08a88f2743c281c39701de4692d550fc1b63dbcca289643cadc01",
    "sanitized_sha256": "6984b5fa11f8dba38e47dde7ac1675c498a3132fb10a97f4056e2f9b6315729d",
    "source_sha256": "d006514de01b48836879e1d236973c55be4b5e51a5c49772f266167e7a77b3d4"
  },
  "recommendation": "Keep quarantined until sanitization and verifier binding are complete.",
  "removed_fragments": [],
  "required_verifiers": [],
  "schema_version": 1,
  "skill_name": "engineering-performance-profile",
  "source": {
    "author": "OneCode Project",
    "captured_at": "2026-06-04T07:47:13Z",
    "collected_by": "onecode-local-seed",
    "license": "Apache-2.0",
    "path": "batches/batch-005-minimum-three/engineering-performance-profile",
    "reference": "docs/batches/batch-005-minimum-three.md",
    "type": "local_folder",
    "url": "https://github.com/aidi1723/onecode/tree/main/onecode-skill-sanitizer/batches/batch-005-minimum-three/engineering-performance-profile",
    "usage": "local_authoring"
  },
  "summary": {
    "preserved_sections": [],
    "removed_fragment_count": 0,
    "rewritten_fragment_count": 0,
    "risk_level": "low",
    "status": "trusted",
    "unresolved_finding_count": 0
  },
  "taxonomy": {
    "artifact_type": "deployment",
    "category": "engineering",
    "collection_priority": "P0",
    "subcategory": "engineering.performance",
    "task_intent": "profile and improve software performance safely"
  }
}
