{
  "approved_at": "2026-06-04T07:10:07Z",
  "files": [
    "SKILL.md",
    "skill.json"
  ],
  "findings": [],
  "hashes": {
    "manifest_sha256": "e77f2f1132ab3d14b373f05de410b9dac2ca48c4425c0325cf7fc644d27729fe",
    "sanitized_sha256": "e1ee2da26234264ea86abb041504f48deaf3da595883d7a48ba8342254156094",
    "source_sha256": "544e0255bb143d3aee738e77b8e38f2aaeb407908d0946f72287b2291d7d844e"
  },
  "recommendation": "Keep quarantined until sanitization and verifier binding are complete.",
  "removed_fragments": [],
  "required_verifiers": [],
  "schema_version": 1,
  "skill_name": "compliance-privacy-check",
  "source": {
    "author": "OneCode Project",
    "captured_at": "2026-06-04T07:09:23Z",
    "collected_by": "onecode-local-seed",
    "license": "Apache-2.0",
    "path": "batches/batch-003-coverage-seed/compliance-privacy-check",
    "reference": "docs/batches/batch-003-coverage-seed.md",
    "type": "local_folder",
    "url": "https://github.com/aidi1723/onecode/tree/main/onecode-skill-sanitizer/batches/batch-003-coverage-seed/compliance-privacy-check",
    "usage": "local_authoring"
  },
  "summary": {
    "preserved_sections": [],
    "removed_fragment_count": 0,
    "rewritten_fragment_count": 0,
    "risk_level": "low",
    "status": "trusted",
    "unresolved_finding_count": 0
  },
  "taxonomy": {
    "artifact_type": "policy",
    "category": "compliance",
    "collection_priority": "P2",
    "subcategory": "compliance.privacy",
    "task_intent": "check privacy and data-handling risk"
  }
}
