{
  "approved_at": "2026-07-02T13:57:28Z",
  "files": [
    "SKILL.md",
    "skill.json"
  ],
  "findings": [],
  "hashes": {
    "manifest_sha256": "41528d02904f132510c85022cb974179eff353ab636ac977a2d6b4eec2f6ffc1",
    "sanitized_sha256": "6f79d8f82fe6aa2bbf73aa429af376c21ba273d4ddf4c5239b9259a66e4c5277",
    "source_sha256": "2b731fe863df8f356b3bad373826abfb5f1d5012afcded4944d1555047106ef8"
  },
  "recommendation": "Keep quarantined until sanitization and verifier binding are complete.",
  "removed_fragments": [],
  "required_verifiers": [],
  "schema_version": 1,
  "skill_name": "research-operations-governance-review",
  "source": {
    "author": "OneCode Project",
    "captured_at": "2026-07-02T13:57:00Z",
    "collected_by": "onecode-claude-skills-authoring-wave",
    "license": "Apache-2.0",
    "path": "batches/batch-028-claude-skills-authoring-wave/research-operations-governance-review",
    "reference": "docs/batches/batch-028-claude-skills-authoring-wave.md; metadata-only claude-skills authoring wave",
    "type": "local_folder",
    "url": "https://github.com/aidi1723/safe-agent-skills",
    "usage": "local_authoring"
  },
  "summary": {
    "preserved_sections": [],
    "removed_fragment_count": 0,
    "rewritten_fragment_count": 0,
    "risk_level": "low",
    "status": "trusted",
    "unresolved_finding_count": 0
  },
  "taxonomy": {
    "artifact_type": "workflow",
    "category": "research",
    "collection_priority": "P1",
    "subcategory": "research.operations",
    "task_intent": "review research operations governance, study intake, participant handling, evidence lineage, repository hygiene, and insight delivery workflows"
  }
}
