{
  "approved_at": "2026-06-05T13:08:38Z",
  "files": [
    "SKILL.md",
    "skill.json"
  ],
  "findings": [],
  "hashes": {
    "manifest_sha256": "ebbca4d8bda636159d527f131304793547f68900c69935326d2310cc03bb7436",
    "sanitized_sha256": "d105aea8ae5d8446d2a4ea7d7cd54dce1e569f4761034e5a49a1e7b7ecc7cbee",
    "source_sha256": "8f348a217dd395e8b3b8122050fa2628ce76df4616299cf06c08b4a4ac466145"
  },
  "recommendation": "Keep quarantined until sanitization and verifier binding are complete.",
  "removed_fragments": [],
  "required_verifiers": [],
  "schema_version": 1,
  "skill_name": "ai-tool-schema-protocol-check",
  "source": {
    "author": "OneCode Project",
    "captured_at": "2026-06-05T13:08:15Z",
    "collected_by": "onecode-local-seed",
    "license": "Apache-2.0",
    "path": "batches/batch-013-ai-runtime-guardrails/ai-tool-schema-protocol-check",
    "reference": "docs/batches/batch-013-ai-runtime-guardrails.md",
    "type": "local_folder",
    "url": "https://github.com/aidi1723/safe-agent-skills/tree/main/batches/batch-013-ai-runtime-guardrails/ai-tool-schema-protocol-check",
    "usage": "local_authoring"
  },
  "summary": {
    "preserved_sections": [],
    "removed_fragment_count": 0,
    "rewritten_fragment_count": 0,
    "risk_level": "low",
    "status": "trusted",
    "unresolved_finding_count": 0
  },
  "taxonomy": {
    "artifact_type": "prompt",
    "category": "ai",
    "collection_priority": "P0",
    "subcategory": "ai.tool-schema",
    "task_intent": "check AI tool schemas and protocol contracts"
  }
}
