{
  "approved_at": "2026-07-03T12:40:44Z",
  "files": [
    "SKILL.md",
    "skill.json"
  ],
  "findings": [],
  "hashes": {
    "manifest_sha256": "cf90afcb0b6f8bebae7df0024d890fb010e171ed955fd3b1715998ff52176353",
    "sanitized_sha256": "d9feea2f437d1288f74ca93a3929aeeb5922ea9f24669a309a5f94c21953c9f8",
    "source_sha256": "03991bf5b34b8012e00597f3f272d69a33bad5fab60900fed22a4a8df19deb54"
  },
  "recommendation": "Keep quarantined until sanitization and verifier binding are complete.",
  "removed_fragments": [],
  "required_verifiers": [],
  "schema_version": 1,
  "skill_name": "design-design-md-system-contract",
  "source": {
    "author": "OneCode Project",
    "captured_at": "2026-07-03T12:40:29Z",
    "collected_by": "onecode-reference-pattern-expansion",
    "license": "Apache-2.0",
    "path": "batches/batch-032-reference-pattern-expansion/design-design-md-system-contract",
    "reference": "docs/batches/batch-032-reference-pattern-expansion.md; reference analysis of Google DESIGN.md ecosystem references",
    "type": "local_folder",
    "url": "https://github.com/aidi1723/safe-agent-skills/tree/main/batches/batch-032-reference-pattern-expansion/design-design-md-system-contract",
    "usage": "local_authoring"
  },
  "summary": {
    "preserved_sections": [],
    "removed_fragment_count": 0,
    "rewritten_fragment_count": 0,
    "risk_level": "low",
    "status": "trusted",
    "unresolved_finding_count": 0
  },
  "taxonomy": {
    "artifact_type": "design_system",
    "category": "design",
    "collection_priority": "P1",
    "subcategory": "design.system",
    "task_intent": "create and review DESIGN.md contracts with tokens, component states, accessibility, responsiveness, and implementation alignment"
  }
}
