{
  "approved_at": "2026-07-03T12:40:44Z",
  "files": [
    "SKILL.md",
    "skill.json"
  ],
  "findings": [],
  "hashes": {
    "manifest_sha256": "851489501f1097ef546fc57e423c5cfac8c92cb3164965f54503863a6ffe9223",
    "sanitized_sha256": "cf58e783e73027a872f762a1b99f42c2d3f23eb4471721c56fe7e6cf2ae36811",
    "source_sha256": "f6bff17eaf631319320facd008650114386b95850fa8b458058d3cce9d4c58ef"
  },
  "recommendation": "Keep quarantined until sanitization and verifier binding are complete.",
  "removed_fragments": [],
  "required_verifiers": [],
  "schema_version": 1,
  "skill_name": "compliance-private-communication-boundary",
  "source": {
    "author": "OneCode Project",
    "captured_at": "2026-07-03T12:40:29Z",
    "collected_by": "onecode-reference-pattern-expansion",
    "license": "Apache-2.0",
    "path": "batches/batch-032-reference-pattern-expansion/compliance-private-communication-boundary",
    "reference": "docs/batches/batch-032-reference-pattern-expansion.md; reference analysis of https://github.com/simplex-chat/simplex-chat",
    "type": "local_folder",
    "url": "https://github.com/aidi1723/safe-agent-skills/tree/main/batches/batch-032-reference-pattern-expansion/compliance-private-communication-boundary",
    "usage": "local_authoring"
  },
  "summary": {
    "preserved_sections": [],
    "removed_fragment_count": 0,
    "rewritten_fragment_count": 0,
    "risk_level": "low",
    "status": "trusted",
    "unresolved_finding_count": 0
  },
  "taxonomy": {
    "artifact_type": "risk_report",
    "category": "compliance",
    "collection_priority": "P1",
    "subcategory": "compliance.privacy",
    "task_intent": "review private communication workflows for identifier minimization, metadata privacy, E2EE boundaries, retention, and abuse handling"
  }
}
